1	Kepis	Norizzati Bt Abd Manaf	Norhasliza Ruslan	013-6437378/012-3896106	norizzati.manaf@celcom1cbc.com/norhasliza@celcom1cbc.com	kepis
2	Jelai 4	Hasanatul Atiah Jaidin	Siti Halijah Binti Sahrum 	012-9950249/017-6280562	hasanatul@celcom1cbc.com/siti.halijah@celcom1cbc.com	jelai-4
3	Pasir Besar	Nur Izayanty bt Nazar	Nor Shafiqah Bt Mohd Yussof	017-3590068/017-3700062	nurizayanty@celcom1cbc.com/fiqahyussof@celcom1cbc.com	pasir-besar
4	Sg Kelamah	Siti Nur Izzattie Bt Noor Haslin	Muhammad Firdaus bin Jaafar	019-3748683/019-3725479	izzattie@celcom1cbc.com /firdaus@celcom1cbc.com	sg-kelamah
5	Bukit Jalor	Norizzati Abd Rashid	Siti Radhiah Binti Md Isa	019-7833745/018-2083682	norizzati@celcom1cbc.com/radhiah@celcom1cbc.com	bukit-jalor
6	Bukit Rokan	Nor Azizah Shamsuddin	Nur Shuhadah Binti Zolkapley	019-6364364/014-3832429	azizah@celcom1cbc.com/shuhadah@celcom1cbc.com	bukit-rokan
